{
  "schema_version": 1,
  "event_id": "evt_0123456789abcdef0123456789abcdef",
  "event_type": "request.started",
  "event_time_utc": "2026-07-20T12:17:37.000000Z",
  "correlation_id": "req_fedcba9876543210fedcba9876543210",
  "trace_id": "00112233445566778899aabbccddeeff",
  "span_id": "0011223344556677",
  "parent_event_id": null,
  "service_name": "gpt-rag-orchestrator",
  "service_version": "3.7.0",
  "environment": "test",
  "operation": "orchestrator.stream_response",
  "status": "started",
  "reason_code": "request_received",
  "capture_mode": "metadata_only",
  "redaction_applied": false,
  "omitted_fields": [],
  "truncated_fields": []
}
